{
  "$schema": "http://json-schema.org/draft-04/schema#",
  "id": "http://uk.gov.moj.cpp/staging/prosecutors/json/schemas/submit-material-v3.json",
  "type": "object",
  "properties": {
    "material": {
      "$ref": "http://justice.gov.uk/domain/core/common/definitions.json#/definitions/uuid"
    },
    "materialContentType": {
      "description": "Specifies the format type of the content",
      "type": "string"
    },
    "materialType": {
      "description": "Defines if the material is case level or defendant level",
      "type": "string",
      "maxLength": 40
    },
    "materialName": {
      "description": "The business description of the material contents",
      "type": "string",
      "maxLength": 255
    },
    "fileName": {
      "type": "string",
      "maxLength": 255
    },
    "sectionOrderSequence": {
      "description": "The sequence in which the material is placed within the required section within the case file",
      "type": "integer",
      "maxLength": 6
    },
    "caseSubFolderName": {
      "description": "The name of a subfolder within the relevant section (material type) within the case file in which the material is placed",
      "type": "string",
      "maxLength": 35
    },
    "exhibit": {
      "description": "The details of the exhibit when the material provided is an exibit of evidence",
      "$ref": "http://cpp.moj.gov.uk/staging/prosecutors/json/schemas/exhibit.json"
    },
    "witnessStatement": {
      "description": "The details of the witness statement when the material provided is statement provided by the investigating authority",
      "$ref": "http://cpp.moj.gov.uk/staging/prosecutors/json/schemas/witness-statement.json"
    },
    "tag": {
      "description": "A collection of tags that provide further type categorisation and description of the material",
      "type": "array",
      "minItems": 1,
      "items": {
        "$ref": "http://cpp.moj.gov.uk/staging/prosecutors/json/schemas/material-tag.json"
      },
      "uniqueItems": true
    },
    "courtApplicationSubject": {
      "$ref": "http://cpp.moj.gov.uk/staging/prosecutors/json/schemas/court-application-subject.json"
    },
    "prosecutionCaseSubject": {
      "$ref": "http://cpp.moj.gov.uk/staging/prosecutors/json/schemas/prosecution-case-subject.json"
    }
  },
  "oneOf": [
    {
      "required": [
        "prosecutionCaseSubject"
      ]
    },
    {
      "required": [
        "courtApplicationSubject"
      ]
    }
  ],
  "required": [
    "material",
    "materialContentType",
    "materialType",
    "materialName",
    "fileName"
  ],
  "additionalProperties": false
}
