{
  "material": "2191c165-e9e4-4fd7-ac6d-5bfd04690f77",
  "materialContentType": "text/plain",
  "materialName": "defendant document",
  "materialType": "SJPN",
  "fileName": "Material-File",
  "sectionOrderSequence": 1,
  "caseSubFolderName": "Defendant-Material",
  "exhibit": {
    "reference": "test-reference"
  },
  "witnessStatement": {
    "statementNumber": 2,
    "statementDate": "2021-03-09T14:30:04.881Z"
  },
  "tag": [
    {
      "code": "M35"
    }
  ],
  "prosecutionCaseSubject": {
    "caseUrn" : "CASETFL001",
    "prosecutingAuthority":"00TFL1A",
    "defendantSubject":{
      "prosecutorPersonDefendantDetails":{
        "forename":"David",
        "surname": "Miller",
        "prosecutorDefendantId": "2b9c0dac-deeb-4634-ba69-be5115bdc585",
        "dateOfBirth": "1990-10-23"
      }
    }
  }
}

